symbol,market_phase,phase_confidence,phase_confidence_score,structure_quality,trend_structure,effort_vs_result,volume_behavior,accumulation_distribution,composite_operator,structural_events,key_observations,caution_flags
GOF,Accumulation,Low,42,Mixed,Primary downtrend from 13.04 (Jan 6) to current 10.74 | Lower highs and lower lows dominant | Tentative stabilization zone forming 10.61–11.02 | No confirmed higher low structure yet,Effort-Result divergence present on downside | Mar 6–9 high volume climactic-style drop (2.9M–3.6M) with diminishing result | Apr–May rally on moderate volume shows weak demand | Jun selling resumes on moderate volume suggesting continued distribution or re-accumulation test,Climactic selling volume Mar 9 (3.62M) | Volume drying up on rallies (Apr 7: 811K | Apr 24: 567K) suggesting weak demand | Jun 9 spike (1.93M) on down close = supply re-entering | Jun 18 (2.33M) on wide down bar = renewed supply pressure | No clear Selling Climax + Automatic Rally sequence confirmed,Ambiguous | Price structure leans toward continued distribution or deep re-accumulation base | 10.61–10.74 represents potential Preliminary Support / Selling Climax zone | No Automatic Rally with strength confirmed yet,Composite Operator behavior suggests controlled markdown with periodic absorption testing | No clear evidence of aggressive accumulation | Possible re-accumulation attempt Apr–May failed at 11.63 | CO likely still distributing or testing absorption depth,"Potential PSY: Jan 6 (13.04) | Potential BC/SC zone: Mar 9 (11.07 low, 3.62M) | Automatic Rally attempt: Mar 31–Apr 10 (10.65→11.54) | Secondary Test: May 15–18 (11.13–10.99, elevated volume) | Potential Spring candidate: Mar 27 (10.59) | Failed rally / LPSY candidate: Apr 21 (11.63) | Renewed weakness: Jun 16–22 (10.81→10.645)","13-week downtrend from 13.04 to 10.645 (~18.3% decline) | Selling volume climaxed Mar 9 but no confirmed demand follow-through | Apr–May consolidation range 10.61–11.63 shows narrow spread, low volume = possible cause building OR continued weakness | Jun breakdown below 10.81 support threatens base integrity | Current price 10.74 near multi-month lows | Volume on recent selling moderate, not climactic = no confirmed SC yet",No confirmed Spring with strong upthrust | Jun 18–22 price action threatens to break below Mar 27 low (10.59) = invalidation of accumulation thesis | Low-volume rallies indicate absence of institutional demand | Phase C Spring may not yet be complete | Risk of Phase D markdown continuation if 10.59 breaks on volume | Premature long entries carry significant risk
SFL,Accumulation,Low,52,Mixed,Uptrend from Dec 2025 to May 2026 peak (~7.70→12.90) | Distribution range forming ~12.07–12.94 | Correction to ~10.96 support zone | Nascent base building ~10.93–11.49,"Strong effort on Feb-11 breakout (5.75M vol, +8.7% range) confirms Composite Operator involvement | May-12 spike (2.7M, +7%) shows climactic buying | Subsequent pullback on elevated volume = supply overcoming demand | Jun recovery on moderate volume = tentative demand return",Expanding volume on upside breakouts (Jan–Feb) | Climactic volume at May top (BCLX behavior) | Elevated volume on decline May-22 to May-29 = distribution/markdown | Declining volume on Jun sideways = absorption possible | Jun-12 and Jun-15/16 moderate uptick on advance = constructive,Prior phase: Accumulation (Dec 2025 – Jan 2026) | Mid phase: Markup (Feb – early May 2026) | Recent phase: Distribution top / early markdown (May 12–29) | Current: Possible re-accumulation (Jun 2026),Markup phase driven by CO clearly visible Feb–Apr | Climactic action May-12 suggests CO offloading near top | Current behavior suggests CO testing demand in 10.93–11.49 range | No confirmed re-entry signal yet,PS (Preliminary Support): ~Dec 29 base ~7.70 | SC (Selling Climax / base): ~Dec 31 7.66 low | SOS (Sign of Strength): Jan 5–7 breakout with expanding volume | JAC (Jump Across Creek): Feb 11 gap-surge on 5.75M volume | BCLX (Buying Climax): May 12 ~12.90 on 2.7M | ARD (Automatic Reaction from Distribution): May 22–29 ~12.28→11.00 | ST (Secondary Test): Jun range 10.93–11.14 | Possible Spring test: Jun 17–18 dip to 10.59–10.81,1. Full Wyckoff markup cycle completed Dec 2025–May 2026 | 2. BCLX confirmed at 12.90 with volume spike | 3. Distribution range ~12.07–12.94 | 4. Markdown reached ~10.59 (Jun-18) = potential Spring candidate | 5. Jun-22 recovery to 11.25 on elevated volume (1.95M) may signal Spring completion | 6. Structure requires LPS and SOS above 11.50 to confirm re-accumulation,No confirmed LPS yet — premature to call re-accumulation complete | Jun volume inconsistent — not uniformly declining on rallies | Distribution range supply (~12.07–12.94) remains significant overhead | Spring at 10.59 unconfirmed — could be continuation of markdown | Broader market context unknown — external risk not assessed
TRIN,Markup,Low,52,Clean,Higher lows established from Mar 2026 lows (~14.13) | Uptrend from Mar bottom to May 6 peak (17.38) | Post-peak consolidation/lateral drift 16.49–17.29 | No new highs since May 6,Effort-Result divergence present | High volume on Feb 2 drop (2.69M) with large down range = supply | Mar 16 (2.02M) downthrust = selling climax candidate | May 6 (2.03M) spike to 17.38 with failure = upthrust or buying exhaustion | Recent low-volume drift near highs = weak demand,"Declining volume on rallies post-May 6 | Volume spikes accompany selling events (Feb, Mar) | Accumulation-phase volume pattern (high on lows, low on highs) partially present Mar–Apr | Recent volume drying up near resistance = lack of conviction",Net Accumulation from Mar 2026 lows | Early phase showed distribution signals (Jan–Feb sell-off) | Re-accumulation pattern Mar–Apr with higher lows | Distribution risk emerging post-May 6 high with narrowing range and fading volume,Absorbed supply through Feb–Mar decline | Markup initiated Apr–May | Currently testing commitment at 16.72–17.29 resistance zone | CO behavior ambiguous — no aggressive re-entry volume supporting continuation,Preliminary Support (PS): ~Mar 16 @ 14.13 | Selling Climax (SC): Mar 16–17 @ 14.13–14.18 | Automatic Rally (AR): Apr–May rally to 17.38 | Secondary Test (ST): Mar–Apr lateral base ~14.29–14.91 | Sign of Strength (SOS): Apr 13–17 surge to 16.17+ | Last Point of Support (LPS): Apr 22–24 pullback ~15.60–15.84 | Upthrust (UT) candidate: May 6 @ 17.38 high on volume | Back Up to Edge of Creek (BUEC): May–Jun lateral 16.49–17.29,Price ranged 14.13–17.38 over observation window | Strong recovery from Mar lows (+23%) | Price now consolidating 3–4% below May 6 peak | Volume contracting significantly in Jun (616K–1.83M range) | 17.00–17.38 acts as resistance ceiling | 16.49–16.72 is near-term support floor | Jun 22 close 16.875 on elevated volume (1.83M) = possible renewed interest,May 6 high (17.38) not retested with conviction — possible UT | Volume declining on approach to resistance = weak markup signal | Multiple failed closes above 17.20 in Jun | Narrow consolidation range may precede breakdown if support at 16.49 fails | No clear BUEC confirmation yet | Prolonged lateral action post-markup = potential Phase B of distribution forming
ARI,Accumulation,Low,38,Clean,Broad lateral range ~9.60–11.24 | Sharp markup Jan-28 (SC-like thrust) | Subsequent redistribution/re-accumulation contested | Gradual erosion from Apr highs | Recent heavy-volume weakness Jun-16 to Jun-18,"Jan-28 massive effort (5.3M vol, +6.8% gap) yielded diminishing follow-through | Mar-20 high volume (3.9M) produced sharp drop to 10.06 (effort confirms supply) | Jun-16/17/18 extreme volume (3.6M/3.5M/5.0M) with narrow closes and no upside progress = massive supply effort with poor result",Low volume base Dec-Jan (~650K–1.5M) | Spike Jan-28 climactic (5.3M) | Elevated absorption Feb–Mar | Decreasing volume on rallies Apr–May | Climactic selling/absorption Jun-16 to Jun-18 (anomalous 5M day) | Volume expansion on down-closes dominates recent structure,Ambiguous | Initial post-spike behavior (Feb–Mar) shows distribution characteristics | Apr rally suggests re-accumulation attempt | May–Jun progressive narrowing with supply re-emergence | Net read: Distribution/Redistribution favored,Appears to have marked up aggressively Jan-28 (possible news/event driven) | Now distributing into residual demand | Jun high-volume days suggest CO offloading into any rally | No clear commitment to new markup phase,Possible SC/AR: Jan-28 spike high 11.21 | Secondary Test: Feb range 10.68–10.95 | LPSY candidates: Apr-15 (11.24 high) | Apr-28 (11.19) | SOW (Sign of Weakness): Mar-20 drop to 10.06 on 3.9M vol | Jun-12 to Jun-15 step-down | Potential UTAD failure: Apr-15 11.24 unable to sustain | Jun climactic volume = possible Terminal Shakeout or final distribution,Price has failed to exceed Jan-28 spike high (11.21) meaningfully | Multiple tests of 10.40–10.50 support held but weakening | Jun-18 5M volume bar closes mid-range at 10.83 after testing 10.68 = ambiguous (could be stopping action or hidden supply) | Range compression 10.63–11.24 post-spike | 60-day structure shows lower highs (11.24 → 11.19 → 11.08 → 11.04) | Support ~10.40–10.50 critical,Jan-28 spike may be news/catalyst-driven invalidating pure Wyckoff volume interpretation | Jun-16 to Jun-18 volume anomaly unresolved — absorption or distribution unclear | No confirmed Spring or LPS to validate accumulation thesis | Price below mid-range of post-spike structure | Repeated failed rallies above 11.10 signal persistent overhead supply | Low-confidence classification due to contaminated structure and potential external fundamental drivers
DOLE,Distribution,High,72,Clean,Bearish — lower highs and lower lows dominant from Feb 2026 peak (~16.57) through June 2026 (~13.87) | Rally attempts repeatedly fail at declining resistance,"Bearish divergence dominant — large volume days (Feb 25, Mar 20, May 29, Jun 4, Jun 8, Jun 18) show poor upside result or accelerated decline | May 11 wide-range bar on high volume reversed sharply next day (UTAD/SOW signal)",Volume expands on down moves and failed rallies | Climactic-style volume on May 29 (3.6M) and Mar 20 (3.2M) with weak closes | Post-climax rallies low-volume and narrow-range | Elevated volume on June breakdown bars confirms distribution absorption exhausting,Distribution confirmed — price unable to sustain above 16.00 after Feb peak | Progressive supply dominance | No credible sign of strength (SOS) bar sustained | Demand responses weak and short-lived,Selling into strength — CO appears to have distributed between ~15.30–16.57 (Jan 21–Feb 6 window) | Subsequent markup attempts used to offload remaining supply | Current behavior consistent with CO withdrawing bids,"PSY/BC Candidate: Feb 4 (16.505 high, 1.4M vol spike) | UT/UTAD: May 11 (wide range spike to 15.29, reversed violently) | SOW #1: Mar 3–5 (breakdown below 15.50) | SOW #2: May 12–15 (sharp reversal from 15.61 to 14.10) | LPSY zones: Mar 23–27 rebound | Apr 6–10 rebound (failed ~15.73) | ICE Break: May 29 (3.6M vol close at 13.99) | Markdown Confirmation: Jun 3, Jun 8, Jun 22 (new lows)","Price peaked at 16.57 (Feb 6) and has not recovered | Each rally produces lower highs (15.73, 15.57, 15.29, 14.74, 14.22) | Volume structure shows clear supply overhang | May 29 climactic bar broke key 14.10–14.20 support on massive volume | June 2026 trading entirely below previous support levels | Jun 22 low of 13.745 marks new markdown low | No accumulation base yet established",May 11 spike could be interpreted as a shakeout/spring if price recovers above 15.00 sustainably — not confirmed | Some mid-range consolidation zones (Mar–Apr) could be re-accumulation if broader context is bullish — currently not supported | Volume on Jun 10–16 relatively lower suggesting possible temporary exhaustion of sellers — watch for potential secondary test | Phase label could shift to Markdown Phase E if 13.60 support fails decisively
TWO,Accumulation,High,62,Mixed,Prior Uptrend (Jan) → Markdown (Jan-Mar) → Potential Re-Accumulation Base (Mar-Jun) | Current structure: sideways compression 12.24–12.72 zone,Effort without result dominant in Jun consolidation — high volume on Mar 19 (16.5M) produced follow-through; Jun volume contracting with minimal price movement indicating absorption,Climactic volume Jan 9 (11.5M) at price high | Selling climax Feb 25 (9.97M) at low | Rally volume Mar 19 (16.5M) | Volume steadily declining in current range — consistent with absorption/re-accumulation,Net Accumulation bias — price holding above re-accumulation lows | Composite operator appears to be absorbing supply in 12.24–12.72 range | No distribution characteristics evident in current phase,Absorbing supply in narrow range | Testing commitment of weak holders | Preparing potential markup — no aggressive distribution detected,Preliminary Supply (PSY): 2026-01-16 @ 14.17 | Buying Climax (BC): 2026-01-16 @ 14.17 | Automatic Reaction (AR): 2026-01-30 @ 11.21 | Secondary Test (ST): 2026-02-03 @ 12.68 | Sign of Weakness (SOW): 2026-02-25 @ 9.00 low / Selling Climax | Automatic Rally (AR2): 2026-03-19 @ 10.95 | Spring Candidate: 2026-03-09 @ 8.78 | Last Point of Support (LPS): 2026-03-17–18 | Sign of Strength (SOS): 2026-03-19–23 rally | Re-Accumulation Range: 2026-04-06 to present @ 10.94–12.72,,Prolonged consolidation Jun with declining volume may indicate distribution if price fails to break above 12.72 | Jun 22 close at 12.195 shows mild slippage — watch for SOW below 12.14 | No confirmed SOS breakout above 12.72 resistance yet | Low volume rallies in Jun suggest weak demand | Risk of Phase D failure if 11.00 support revisited
